{
  "version": "1.0",
  "title": "Forgotten History of AI — Episode 01: ELIZA",
  "total_duration_seconds": 3018.2,
  "voice_performance": {
    "performance_intent": "calm, evidence-driven historian; never sells",
    "pacing_profile": "contemplative",
    "pause_policy": "one beat between sections, longer holds at hero moments",
    "sample_section_id": "s01",
    "provider_notes": {
      "voice_reference": "simon_evers.flac sha256 3260517de0220d583890db9da0815bd0d53987b68df4d9301ff04c20a5bb64da",
      "provider": "omnivoice kaggle kernel forts845/omnivoice v2",
      "output_spec": "pcm_s16le 24000 Hz"
    }
  },
  "sections": [
    {
      "id": "s01",
      "label": "COLD OPEN: THE SECRETARY",
      "text": "MIT, 1966. A computer scientist named Joseph Weizenbaum writes a few hundred lines of code called DOCTOR and wires it into a program he names ELIZA — after Eliza Doolittle, the woman who was taught to speak. It understands nothing. It reflects your words back at you, dressed up as questions. And that was enough.\n\nHis own secretary — the person closest to his work — asked him to leave the room so she could talk to it in private. Psychiatrists saw a future therapist. Weizenbaum saw something else: how easily we hand our trust to machines that hold none of it.\n\nThis is the story of a few-hundred-line parlor trick — and of the man who spent his remaining thirty years explaining why we believed it.\n\nIt starts with a joke that wasn't one. It runs through a machine that couldn't understand a single sentence it heard — and the psychiatrists who wanted to prescribe it anyway. And it ends with the most uncomfortable question in modern computing, asked out loud by the one man who knew exactly how little was under the hood.\n\nThe machine is gone. The room it opened has never closed.",
      "start_seconds": 0.0,
      "end_seconds": 92.1,
      "speaker_directions": "calm evidence-driven historian register, even cadence",
      "delivery_cues": {
        "pace": "measured",
        "energy": "low, controlled",
        "pause_before_seconds": 0.5
      },
      "source_ref": "SOURCE_REGISTER items 1-7 (see eliza_script_draft.md)"
    },
    {
      "id": "s02",
      "label": "THE MAN WHO WOULD BUILD IT",
      "text": "To understand why ELIZA was built, you have to understand who built it — and what he had already seen machines do.\n\nJoseph Weizenbaum was born in Berlin. His Jewish family got out of Germany when he was a child, in the mid-nineteen-thirties, and resettled in Detroit. He grew up between two worlds — a country that had turned on its own neighbors with industrial precision, and a new one rebuilding itself around machines. He spent his early career close to the biggest of those machines. Before MIT, he worked on some of the earliest large-scale business computing systems in America — the kind built to process bank checks by the millions, where the whole point was that numbers moved reliably and nothing needed to be understood. He came away knowing something intimate about computers that most of his generation learned only later: these are machines of enormous capability and zero comprehension. They count. They sort. They match patterns, very fast, without complaint — and without the faintest idea what any of it means.\n\nIn the early nineteen-sixties, he joined MIT, where a laboratory called Project MAC was pioneering something strange even by the standards of computing research. Time sharing. To appreciate how strange, remember what a computer was in those days: a sealed room, an air-conditioned altar, a machine the size of a school bus that one team of attendants fed decks of cards overnight. You submitted your problem and received your answer hours or days later, like mailing a letter to an oracle. Project MAC cut the oracle into slices. Dozens of people, dozens of keyboards, all wired to the same machine at once, each of them receiving a sliver of its attention in rapid rotation. The computer stopped being a place you visited and became something you sat with.\n\nPicture the physical experience for a moment, because the whole story lives inside it. You sat at a console that looked like a typewriter married to a television tube. You typed a line. The machine answered while you were still leaning forward. Paper chattered out of the printer carrying your exchange — your words and its replies interleaved on the same page, like a transcript of a discussion. Nobody had ever seen a machine behave this way. Calculation was supposed to be silent and distant. This thing replied.\n\nAnd the terminals were not private booths. People worked within sight and sound of each other, in shared rooms lit like drafting halls. You could watch a colleague lean toward the glass and start typing sentences no spreadsheet had ever demanded. The machine asked nobody anything. It simply replied — and watched human beings organize their thoughts into confessions.\n\nThat rewrote the texture of human-machine contact. For the first time, conversation pace became possible between a person and a computer. Anyone who has waited a day for a printout knows what an instant reply does to a mind. It stops feeling like computation and starts feeling like company.\n\nAnd notice, again, how the paper frames the work — as the study of communication between man and machine. Both parties. Most research of the era treated the machine side as the only variable worth engineering: make the language understanding better and the interaction improves. Weizenbaum's framing allowed for something the field had no instruments to measure — that the human side of the channel was doing enormous, invisible work: projecting tone onto capital letters, assuming memory behind stored strings, supplying intent behind templates. If communication is a two-body system, then the machine's half barely needed to move for the exchange to look alive. Building a deliberately minimal machine was the only honest way to measure just how much the human half would carry alone.\n\nMost researchers looked at that new closeness and asked the obvious question: how do we make the machine smarter? How do we close the remaining gap?\n\nWeizenbaum looked at the same scene and asked a different question: what happens to the human side of this exchange? Notice how the title of his paper frames it — not a program for making machines communicate better, but for the study of natural language communication between man and machine. Communication, treated as a two-sided natural phenomenon, like weather or flocking birds — something with laws of its own, observable on both sides of the wire. One of those sides was built from transistors. The other was built from everything a person has ever wanted to be heard. Which of the two would bend to meet the other — that was the actual research question. He already suspected the answer. He had watched it happen across the terminal room.\n\nHe pressed the observation into print twice. The first time was in that nineteen sixty-six paper, where ELIZA appears as a probe — an instrument, not a destination. The second time was a decade later, in his book, where he insisted on the point at greater length and higher volume: ELIZA was never an attempt to build artificial intelligence, and it was certainly not a step toward one. It was designed to demonstrate superficiality — to show, vividly and reproducibly, how shallow the engagement between a man and a machine could be while still feeling completely real to the human being involved.\n\nSit with that for a moment, because almost everyone else in this story forgets it, and some forget it within minutes of being told. The builder did not forget. He built the shallowness on purpose. The depth arrived uninvited — from the other side of the keyboard.",
      "start_seconds": 92.1,
      "end_seconds": 506.1,
      "speaker_directions": "calm evidence-driven historian register, even cadence",
      "delivery_cues": {
        "pace": "measured",
        "energy": "low, controlled",
        "pause_before_seconds": 1.0
      },
      "source_ref": "SOURCE_REGISTER items 1-7 (see eliza_script_draft.md)"
    },
    {
      "id": "s03",
      "label": "WHY CALL IT ELIZA",